[
  {
    "id": "ALT-001",
    "project": "SearXNG",
    "category": "Search",
    "replaces": ["Google Search", "Microsoft Bing"],
    "license": "AGPL-3.0",
    "website": "https://searxng.org",
    "github": "https://github.com/searxng/searxng",
    "self_hosting_requirements": "1 vCPU, 512 MB RAM, Docker container",
    "difficulty": "Beginner",
    "cost_model": "100% Free FOSS (Public instances freely accessible)",
    "privacy_rating": "Zero-tracking, strips IP headers, no user profiling",
    "maturity": "Battle-Tested",
    "malaysian_suitability_summary": "Sesuai untuk individu, universiti, dan pejabat kerajaan yang mahukan enjin carian bebas penjejakan tanpa menjual data pengguna."
  },
  {
    "id": "ALT-002",
    "project": "Mailcow: dockerized",
    "category": "Email",
    "replaces": ["Google Workspace Gmail", "Microsoft 365 Exchange Online"],
    "license": "GPL-3.0",
    "website": "https://mailcow.email",
    "github": "https://github.com/mailcow/mailcow-dockerized",
    "self_hosting_requirements": "2 vCPU, 4-6 GB RAM, 20 GB+ Storage, Static IP with clean rDNS",
    "difficulty": "Intermediate",
    "cost_model": "Free FOSS; hosting cost ~RM60-150/month on local VPS",
    "privacy_rating": "Full on-premises sovereign control, SOGo webmail, DKIM/DMARC",
    "maturity": "Battle-Tested",
    "malaysian_suitability_summary": "Penyelesaian e-mel berdaulat terbaik untuk PKS dan agensi tempatan. Mengelakkan yuran bulanan per-pengguna USD yang mahal."
  },
  {
    "id": "ALT-003",
    "project": "Nextcloud Hub",
    "category": "Cloud Storage",
    "replaces": ["Google Drive", "Microsoft OneDrive", "Dropbox"],
    "license": "AGPL-3.0",
    "website": "https://nextcloud.com",
    "github": "https://github.com/nextcloud/server",
    "self_hosting_requirements": "2 vCPU, 4 GB RAM, LAMP stack or Docker, scalable object storage",
    "difficulty": "Intermediate",
    "cost_model": "Free Community Edition; optional Enterprise support",
    "privacy_rating": "End-to-End Encryption support, zero telemetry, local data residency",
    "maturity": "Battle-Tested",
    "malaysian_suitability_summary": "Pengganti langsung ekosistem Google Workspace untuk sekolah dan jabatan kerajaan. Data fail kekal 100% di dalam sempadan Malaysia."
  },
  {
    "id": "ALT-004",
    "project": "LibreOffice & OnlyOffice",
    "category": "Office & Productivity",
    "replaces": ["Google Docs/Sheets/Slides", "Microsoft 365 Office"],
    "license": "MPL-2.0 / AGPL-3.0",
    "website": "https://www.libreoffice.org",
    "github": "https://github.com/LibreOffice/core",
    "self_hosting_requirements": "Desktop client runs on any modern PC; OnlyOffice Document Server needs 2 vCPU, 4 GB RAM",
    "difficulty": "Beginner",
    "cost_model": "100% Free Open Source",
    "privacy_rating": "Air-gapped desktop offline capability, zero cloud telemetry",
    "maturity": "Battle-Tested",
    "malaysian_suitability_summary": "Format piawai antarabangsa ODF (.odt, .ods) yang boleh dibuka tanpa lesen Microsoft. Sangat stabil untuk pentadbiran sektor awam."
  },
  {
    "id": "ALT-005",
    "project": "Jitsi Meet",
    "category": "Video Conferencing",
    "replaces": ["Zoom", "Google Meet", "Microsoft Teams Video"],
    "license": "Apache-2.0",
    "website": "https://jitsi.org",
    "github": "https://github.com/jitsi/jitsi-meet",
    "self_hosting_requirements": "2-4 vCPU, 4 GB RAM, Debian/Ubuntu VM, high network bandwidth",
    "difficulty": "Intermediate",
    "cost_model": "Free FOSS; public server meet.jit.si available without account",
    "privacy_rating": "End-to-End Encryption (E2EE), no account creation required, no call logs retained",
    "maturity": "Battle-Tested",
    "malaysian_suitability_summary": "Boleh dihoskan terus di pusat data tempatan TM One atau AIMS untuk kependaman (latency) ultra rendah bagi mesyuarat kabinet dan mahkamah."
  },
  {
    "id": "ALT-006",
    "project": "Matrix & Element",
    "category": "Messaging",
    "replaces": ["WhatsApp", "Slack", "Microsoft Teams Chat"],
    "license": "Apache-2.0",
    "website": "https://matrix.org",
    "github": "https://github.com/element-hq/element-web",
    "self_hosting_requirements": "2 vCPU, 4 GB RAM (Synapse or Dendrite server), PostgreSQL",
    "difficulty": "Intermediate",
    "cost_model": "Free FOSS; decentralized federated protocol",
    "privacy_rating": "Olm/Megolm End-to-End Encryption, cryptographic identity verification",
    "maturity": "Battle-Tested",
    "malaysian_suitability_summary": "Telah digunapakai oleh kerajaan Perancis (Tchap) dan tentera Jerman. Protokol terbuka yang ideal untuk infrastruktur komunikasi rasmi Malaysia."
  },
  {
    "id": "ALT-007",
    "project": "Mastodon & PeerTube",
    "category": "Social Media",
    "replaces": ["X (Twitter)", "Facebook", "Instagram", "YouTube"],
    "license": "AGPL-3.0",
    "website": "https://joinmastodon.org",
    "github": "https://github.com/mastodon/mastodon",
    "self_hosting_requirements": "2 vCPU, 4 GB RAM, Ruby on Rails, PostgreSQL, Redis",
    "difficulty": "Intermediate",
    "cost_model": "Free FOSS; community fediverse model",
    "privacy_rating": "No surveillance advertising, no algorithmic manipulation, decentralized moderation",
    "maturity": "Battle-Tested",
    "malaysian_suitability_summary": "Melindungi naratif tempatan daripada penapisan sepihak Silicon Valley. Membolehkan agensi dan universiti membina nod media sosial berdaulat."
  },
  {
    "id": "ALT-008",
    "project": "Debian / Ubuntu LTS / Linux Mint",
    "category": "Operating Systems",
    "replaces": ["Microsoft Windows 11", "Apple macOS", "Google ChromeOS"],
    "license": "GPL and compatible open licenses",
    "website": "https://www.debian.org",
    "github": "https://salsa.debian.org",
    "self_hosting_requirements": "Standard x86_64 or ARM64 hardware; runs smoothly on older PCs",
    "difficulty": "Beginner",
    "cost_model": "100% Free; no recurring OS licensing fees",
    "privacy_rating": "No mandatory online accounts, no telemetric surveillance, fully auditable",
    "maturity": "Battle-Tested",
    "malaysian_suitability_summary": "Menjimatkan ratusan juta ringgit perolehan lesen Windows di sekolah dan makmal komputer luar bandar di Sabah, Sarawak, dan Semenanjung."
  },
  {
    "id": "ALT-009",
    "project": "OpenInfra (OpenStack, StarlingX, Kata) & Proxmox VE",
    "category": "Cloud Infrastructure",
    "replaces": ["AWS EC2/VPC", "Google Compute Engine", "Microsoft Azure VMs", "VMware vSphere / VCF", "AWS Outposts"],
    "license": "Apache-2.0 / AGPL-3.0",
    "website": "https://openinfra.org",
    "github": "https://github.com/openstack",
    "self_hosting_requirements": "Bare metal x86 enterprise servers, virtualization support (VT-x/AMD-V)",
    "difficulty": "Advanced",
    "cost_model": "100% Free Open Source (OpenInfra Foundation backed); RM0 license fees",
    "privacy_rating": "Complete physical and logical sovereignty inside domestic datacenter racks",
    "maturity": "Battle-Tested",
    "malaysian_suitability_summary": "Asas teras bagi Konsortium Awan Berdaulat GLC (TM, TNB, PETRONAS) untuk membina enjin data nasional bebas daripada Akta CLOUD AS dan kenaikan harga lesen Broadcom/VMware."
  },
  {
    "id": "ALT-010",
    "project": "Kubernetes & OpenTofu",
    "category": "Kubernetes & Orchestration",
    "replaces": ["AWS EKS", "Google GKE", "HashiCorp Terraform (BSL)"],
    "license": "Apache-2.0 / MPL-2.0",
    "website": "https://opentofu.org",
    "github": "https://github.com/opentofu/opentofu",
    "self_hosting_requirements": "Cluster of 3+ Linux nodes",
    "difficulty": "Advanced",
    "cost_model": "100% Free Open Source (Linux Foundation backed)",
    "privacy_rating": "Declarative, auditable infrastructure-as-code with zero cloud lock-in",
    "maturity": "Battle-Tested",
    "malaysian_suitability_summary": "Standard industri dunia moden yang membolehkan jurutera tempatan membina sistem awan hibrid mudah alih (cloud-agnostic)."
  },
  {
    "id": "ALT-011",
    "project": "Ollama & LocalAI",
    "category": "Artificial Intelligence",
    "replaces": ["OpenAI ChatGPT", "Google Gemini API", "Microsoft Copilot"],
    "license": "MIT",
    "website": "https://ollama.com",
    "github": "https://github.com/ollama/ollama",
    "self_hosting_requirements": "Modern CPU with AVX2 or consumer GPU (Nvidia/Apple Silicon), 16-32 GB RAM",
    "difficulty": "Beginner",
    "cost_model": "100% Free Open Source; models (Llama 3, DeepSeek, Mistral) freely downloadable",
    "privacy_rating": "Zero outbound network calls; all prompts and data remain 100% in local memory",
    "maturity": "Production-Ready",
    "malaysian_suitability_summary": "Kritikal untuk hospital, bank, dan peguam Malaysia yang mengendalikan rekod perubatan, kewangan, dan rahsia guaman yang dilarang bocor ke luar negara."
  },
  {
    "id": "ALT-012",
    "project": "ComfyUI & Stable Diffusion",
    "category": "Image Generation",
    "replaces": ["Midjourney", "OpenAI DALL-E 3", "Google Imagen"],
    "license": "GPL-3.0",
    "website": "https://www.comfy.org",
    "github": "https://github.com/comfyanonymous/ComfyUI",
    "self_hosting_requirements": "Dedicated GPU with 8 GB+ VRAM (Nvidia RTX series recommended)",
    "difficulty": "Intermediate",
    "cost_model": "100% Free Open Source",
    "privacy_rating": "Local generation without cloud upload or censorship of creative assets",
    "maturity": "Production-Ready",
    "malaysian_suitability_summary": "Membolehkan pereka grafik, agensi kreatif, dan agensi pelancongan tempatan menjana bahan promosi berkualiti tinggi tanpa yuran USD bulanan."
  },
  {
    "id": "ALT-013",
    "project": "CogVideoX & AnimateDiff Pipelines",
    "category": "Video Generation",
    "replaces": ["Runway Gen-3", "OpenAI Sora", "Pika Labs"],
    "license": "Apache-2.0",
    "website": "https://github.com/THUDM/CogVideo",
    "github": "https://github.com/THUDM/CogVideo",